Column,char,dialog,movie
1543,Gandalf,"There never was much hope. Just a fool's hope. Our enemy is ready. His full strength's gathered. Not only orcs, but men as well, Legions of Haradrim from the South, mercenaries from the coast, All will answer Mordor's call.",The Return of the King
1551,Strider,"These are for you. Keep them close, I'm going to have a look round, Stay here",The Fellowship of the Ring
1556,Merry,"Tomatoes, sausages, nice crispy bacon",The Fellowship of the Ring
1564,Legolas,"Govannas v'n gwennen le, Haldir o L'rien.",The Fellowship of the Ring
1565,Haldir,"A, Aragorn in D'nedain istannen le ammen.",The Fellowship of the Ring
1568,Haldir,"We have not had dealings with the dwarves, since the dark days.",The Fellowship of the Ring
1571,Haldir,"You bring great evil with you ,You can go no further!",The Fellowship of the Ring
1576,Gandalf,"Frodo, come and help an old man ,How's your shoulder?",The Fellowship of the Ring
1582,Gollum,"The thieves............... The thieves.The filthy little thieves.Where is it? .............Where is it? They stole it from us.............My precious.........Curse them, we hates them!It's ours, it is, and we wants it!",The Two Towers
1583,Frodo,"This is Sting.You've seen it before......haven't you, Gollum? Release him or I'll cut your throat.",The Two Towers
1587,Sam,"Quiet, you!It's hopeless. Every Orc in Mordor'sgoing to hear this racket. Let's just tie him up and leave him.",The Two Towers
1590,Frodo,"Maybe he does deserve to die.But now that I see him, I do pity him.",The Two Towers
1597,Frodo,"Mordor, Gandalf, is it left or right?",The Fellowship of the Ring
1600,Boromir,"Good, very good.",The Fellowship of the Ring
1604,Gimli,"If anyone was to ask for my opinion, which I note that they're not, I'd say that we were taking the long way round. Gandalf, we could pass through the Mines of Moria. My cousin Balin would give us a royal welcome.",The Fellowship of the Ring
1605,Gandalf,"No Gimli, I would not take the road through Moria unless I had no other choice.",The Fellowship of the Ring
1609,Pippin,"For the Shire. Hold him, hold him down Merry!",The Fellowship of the Ring
1610,Aragorn,"Gentlemen, that's enough!",The Fellowship of the Ring
1611,Aragorn,"The same blood flows in my veins, The same weakness",The Fellowship of the Ring
1612,Arwen,"Your time will come. You will face the same evil and you will defeat it A si i-Dh'ath '-orthor, Aragorn. ' or le a ' or nin.",The Fellowship of the Ring
1616,Aragorn,"You said you would bind yourself to me,foresaking the immortal life of your people",The Fellowship of the Ring
1621,Elrond,"Strangers from distant lands, friends of old. You have been summoned here to answer the threat of Mordor. Middle Earth stands upon the brink of destruction. None can escape it. You will unite or you will fall. Each race is bound to this fate, this one doom., Bring forth the Ring, Frodo",The Fellowship of the Ring
1623,Boromir,"In a dream, I saw the Eastern sky grow dark ,In the West a pale light lingered A voice was crying, your doom is near at hand, Isildur's bane is found, Isildur's Bane",The Fellowship of the Ring
1631,Eomer,"Hasufel! Arod! May these horses bear you to betterfortune than their former masters.,Farewell.",The Two Towers
1637,Eowyn,"Leave me alone, snake!",The Two Towers
1638,Grima,"Oh, but you are alone. Who knows what you've spoken to the darkness ,......in the bitter watches of the night......when all your life seems to shrink. The walls of your bower closing in about you. A hutch to trammel some wild thing in.So fair. So cold. Like a morning of pale spring......still clinging to winter's chill.",The Two Towers
1641,Hama,"I cannot allow you before Theoden King so armed, Gandalf Greyhame. By order of Grima Wormtongue.",The Two Towers
1643,Gandalf,"Hmmm ,You would not part an old man from his walking stick.",The Two Towers
1644,Grima,"My lord, Gandalf the Grey is coming. He's a herald of woe.",The Two Towers
1648,Grima,"A just question, my liege.Late is the hour......in which this conjurer chooses to appear., Lathspell I name him.Ill news is an ill guest.",The Two Towers
1651,Theoden,"Grima.Grima.,Grima.",The Two Towers
1654,Eomer,"Warmongering? How long is it sinceSaruman bought you? What was the promised price, Grima? When all the Men are deadyou will take your share of the treasure?",The Two Towers
1656,Grima,"You see much, Eomer, son of Eomund.",The Two Towers
1660,Gollum,"Dead? No, you cannot kill them. No.",The Two Towers
1663,Gollum,"Hurry, Hobbits.The Black Gate is very close.",The Two Towers
1671,Legolas,"They have feelings, my friend.The Elves began it.Waking up the treesteaching them to speak.",The Two Towers
1673,Legolas,"Aragorn, nad no ennas",The Two Towers
1674,Gandalf,"This will be the end of Gondor as we know it. Here the hammer stroke will fall hardest. If the river is taken, if the garrison at Osgiliath falls, the last defence of this city will be gone.",The Return of the King
1679,Gollum,"Quick, quick! They will see, they will see!",The Return of the King
1680,Gollum,"Come away, come away. Look we have found it. The way into Mordor.",The Return of the King
1701,Sam,"Kingsfoil, aye, its a weed!",The Fellowship of the Ring
1710,Arwen,"I've been looking for you for two days. There are five wraiths behind you, where the other four are I do not know",The Fellowship of the Ring
1716,Galadriel Voice Over,"Three were given to the elves.Immortal, wisest and fairest of all beings. Seven to the dwarf lords, great miners and craftsmen of the mountain halls.And nine, nine rings were gifted to the race of men. Who above all else, desire power.",The Fellowship of the Ring
1720,Eomer,"No pauses, no spills.",The Return of the King
1729,Gandalf,"Yes Gimli! Their own masters cannot find them, if their secrets are forgotten!",The Fellowship of the Ring
1732,Gandalf,"It reads ""The Doors of Durin, Lord of Moria, Speak Friend and Enter""",The Fellowship of the Ring
1734,Gandalf,"Oh it's quite simple. If you are a friend, you speak the password and the doors will open, Annon Edhellen, edro hi ammen!",The Fellowship of the Ring
1735,Gandalf,"Fennas Nogothrim, lasto beth lammen.",The Fellowship of the Ring
1741,Sam,"Get down! I said, down!",The Two Towers
1743,Sam,"He's trying to trick us.If we let him go, he'll throttle usin our sleep.",The Two Towers
1749,Smeagol,"To the Gate, to the Gate!To the Gate, the master says. Yes!",The Two Towers
1756,Sam,"Get off him! Frodo, are you alright?",The Fellowship of the Ring
1766,Gimli,"Nothing, its just a whisp of cloud",The Fellowship of the Ring
1772,Gandalf,"Spies of Saruman. The passage south is being watched, We must take the Pass of Caradhras",The Fellowship of the Ring
1775,Boromir,"It is a strange fate that we should suffer so much fear and doubt over so small a thing ,such a little thing",The Fellowship of the Ring
1779,Gandalf,"Ash nazg durbatul'k, ash nazg gimbatul ash nazg thrakatul'k ,agh burzum-ishi krimpatul.",The Fellowship of the Ring
1781,Gandalf,"I do not ask your pardon Master Elrond for the Black Speech of Mordor may yet be heard in every corner of the West, The Ring is altogether evil",The Fellowship of the Ring
1782,Boromir,"Aye it is a gift! A gift to the foes of Mordor. Why not use this Ring? Long has my father, the Steward of Gondor kept the forces of Mordor at bey. By the ,of our people are your lands kept safe. Give Gondor the weapon of the enemy, let us use it against him",The Fellowship of the Ring
1783,Aragorn,"You cannot wield it. None of us can, The One Ring answers to Sauron alone. It has no other master",The Fellowship of the Ring
1787,Aragorn,"Havo dad, Legolas",The Fellowship of the Ring
1792,Elrond,"The Ring cannot be destroyed, Gimli, son of Gloin, by any craft that we here possess. The Ring was made in the fires of Mount Doom. Only there can it be unmade. It must be taken deep into Mordor and cast back into the firey chasm from whence it came.One of you........... must do this",The Fellowship of the Ring
1805,Theoden,"You have no power here ......Gandalf the ,.",The Two Towers
1806,Gandalf,"I will draw you, Saruman, as poison is drawn from a wound.",The Two Towers
1808,Theoden,"If I go, Theoden dies.",The Two Towers
1812,Theoden,"I know your face., Eowyn. Eowyn.Gandalf?",The Two Towers
1813,Gandalf,"Breathe the free air again, my friend.",The Two Towers
1825,Gandalf,"I am Saruman.Or rather, Sarumanas he should have been.",The Two Towers
1831,Gollum,"Hide, hide!",The Return of the King
1835,Gandalf,"The board is set, the pieces are moving.",The Return of the King
1836,Gollum,"Up, up, up the stairs we go. And then it's into the tunnel.",The Return of the King
1837,Sam,"Hey, what's in this tunnel? You listen to me! You listen good and proper. Anything happens to him, you'll have me to answer to. One sniff that something's not right, one hair that stands up on the back of my neck, its over. No more slinker, no more stinker. You're gone. Got it? I'm watching you.",The Return of the King
1842,Arwen,"Frodo f'r. Ae athradon i hir, tur gwaith nin beriatha hon.",The Fellowship of the Ring
1845,Gaffer,"There's been some strange folk crossing the Shire. Dwarves, others of a less than savoury nature",The Fellowship of the Ring
1848,Bilbo,"Hello, Hello, Fatty Bolger, Lovely to see you, Welcome, Welcome",The Fellowship of the Ring
1849,Frodo,"Go on Sam, ask Rosie for a dance.",The Fellowship of the Ring
1858,Galadriel Voice Over,"For within these rings was bound the strength and will to govern each race. But they were all of them deceived.For another ring was made. In the land of Mordor,in the fires of Mount Doom the dark Lord Sauron forged in secret a master Ring ,to control all others and into this Ring he poured all his cruelty, his malice, and his will to dominate all life. One Ring to rule them all.",The Fellowship of the Ring
1862,Galadriel Voice Over,"Victory was near. But the power of the Ring, could not be undone.",The Fellowship of the Ring
1863,Galadriel Voice Over,"It was in this moment,that Isildur, son of the King, took up his father's sword.",The Fellowship of the Ring
1864,Galadriel Voice Over,"Sauron, the enemy of the Free Peoples of Middle Earth was defeated. The Ring passed to Isildur. Who had this one chance to destroy evil forever. But the hearts of Men are easily corrupted. And the Ring of Power has a will of its own.",The Fellowship of the Ring
1865,Galadriel Voice Over,"It betrayed Isildur ,to his death.And some things that should not have been forgotten were lost.History became legend, legend became myth, and for two and a half thousand years the Ring passed out of all knowledge. Until, when chance came, It ensnared a new bearer.",The Fellowship of the Ring
1868,Gollum,"It came to me, my own, my love, my own, my Precious.",The Fellowship of the Ring
1869,Galadriel Voice Over,"The Ring brought to Gollum unnatural long life. For five hundred years it poisoned his mind. And in the gloom of Gollum's cave it waited. Darkness crept back into the forests of the world. Rumour grew of a shadow in the East, whispers of a nameless fear. And the Ring of Power perceived. Its time had now come. It abandoned Gollum. But something happened then that the Ring did not intend, it was picked up by the most unlikely creature imaginable.",The Fellowship of the Ring
1877,Eowyn,"West' Aragorn, hal",The Return of the King
1881,Theoden,"Ach, don't listen to me. You are young and tonight is for you.",The Return of the King
1882,Gimli,"Heh heh heh heh ,Here, here. Raaar it's the dwarves that go swimming with little, hairy women haha",The Return of the King
1884,Gimli,"heh heh heh, what did I say? He can't hold his liquor.",The Return of the King
1886,Merry And Pippin,"Oh you can search far and wide, You can drink the whole town dry, But you'll never find a beer so brown, But you'll never find a beer so brown, As the one we drink in our hometown, As the one we drink in our hometown.You can drink your fancy ales, You can drink them by the flagon But the only brew for the brave and true,",The Return of the King
1888,Gandalf,"I once knew every spell in all the tongues of elves, men and orcs",The Fellowship of the Ring
1891,Gandalf,"Ando Eldarinwa'a lasta quettanya, Fenda Casarinwa'",The Fellowship of the Ring
1894,Aragorn,"Go on, go on ,Don't worry Sam. He knows the way home.",The Fellowship of the Ring
1900,Gollum,"No. Ashes and dust and thirst there isand pits, pits, pits.And Orcses, thousands of Orcses.And always the Great Eye watching,watching.",The Two Towers
1901,Sam,"Hey! Come back now! Come back!There! What did I tell you? He's run off, the old villain.So much for his promises.",The Two Towers
1902,Smeagol,"This way, Hobbits.Follow me!",The Two Towers
1908,Uruk Hai,"Sick, is he? Give him some medicine, boys!",The Two Towers
1914,Merry,"Yes Pippin, my point is, he's clearly over reacting! Run!",The Fellowship of the Ring
1928,Saruman,"So Gandalf, you try to lead them over Caradhras. And if that fails, where then will you go?",The Fellowship of the Ring
1934,Gandalf,"No! Losto Caradhras, sedho, hodo, nuitho i 'ruith!",The Fellowship of the Ring
1938,Gimli,"If we cannot pass over the mountain, let us go under it! Let us go through the Mines of Moria",The Fellowship of the Ring
1942,Saruman,"Shadow, flame",The Fellowship of the Ring
1943,Boromir,"One does not simply walk into Mordor. Its black gates are guarded by more than just orcs. There is evil there that does not sleep and the great eye is ever watchful. Tis a barren wasteland, riddled with fire and ash and dust. The very air you breathe is a poisonous fume. Not with ten thousand men could you do this.It is folly",The Fellowship of the Ring
1949,Gandalf,"Do you not understand that while we bicker amongst ourselves, Sauron's power grows? ! None can escape it! You'll all be destroyed",The Fellowship of the Ring
1951,Grima,"I've only......ever served you, my lord.",The Two Towers
1954,Aragorn,"No, my lord! No, my lord. Let him go. Enough blood has been spilt on his account.",The Two Towers
1956,Hama,"Hail, Theoden King!",The Two Towers
1968,Gandalf,"Yes, and it will not be easily cured.",The Two Towers
1969,Gimli,"Then we have run all this way for nothing? Are we to leave those poor Hobbits here......in this horrid, dark, dank tree-infested--? I mean, charming......quite charming forest.",The Two Towers
1971,Aragorn,"In one thing you have not changeddear friend.,You still speak in riddles.",The Two Towers
1973,Gaffer,"Young Mr Frodo here, he's cracking!",The Fellowship of the Ring
1978,Hobbit,"Good night, sweet maiden of the golden ale!",The Fellowship of the Ring
1980,Frodo,"Don't worry Sam, Rosie knows an idiot when she sees one!",The Fellowship of the Ring
1986,Frodo,"Nothing. There's nothing, Wait. There are markings, Its some form of Elvish. I can't read it",The Fellowship of the Ring
1987,Gandalf,"There are few who can. The language is that of Mordor, which I will not utter here.",The Fellowship of the Ring
1988,Sam,"Ah, I think I'll just have another ale.",The Fellowship of the Ring
1989,Frodo,"Oh no you dont, Go on",The Fellowship of the Ring
1992,Merry,"No no! the big one, big one!",The Fellowship of the Ring
1993,Bilbo,"Mrs Bracegirdle, how nice to see you. Welcome welcome. Are all these children yours?",The Fellowship of the Ring
1997,Bilbo,"Oh! Thankyou my boy You're a good lad Frodo. I'm very selfish you know. Yes, I am. Very selfish. I don't know why I took you in after your mother and father died, but it wasn't out of charity. I think it was because, of all my numerous relations, you were the one Baggins that showed real spirit.",The Fellowship of the Ring
1999,Bilbo,"No. Well yes, b b b but thats not the point. The point is, Frodo, You'll be alright.",The Fellowship of the Ring
2004,Arwen,"If I leave him now, I will regret it forever. It is time.",The Return of the King
2005,Arwen,"From the ashes of fire shall be woken, A light from the shadow shall spring, Renewed shall be blade that was broken, The crownless again shall be king.",The Return of the King
2008,Arwen,"This was my choice. Ada, whether by your will or not there is no ship now that can bear me hence.",The Return of the King
2011,Pippin,"It's the tree! Gandalf, Gandalf.",The Return of the King
2012,Gandalf,"Yes the white tree of Gondor. The tree of the King. Lord Denethor however, is not the King. He is a steward only, a caretaker of the throne.",The Return of the King
2013,Gandalf,"Now listen carefully. Lord Denethor is Boromir's father. To give him news of his beloved son's death would be most unwise. And do not mention Frodo or the Ring. And say nothing of Aragorn either. In fact, its better if you don't speak at all Peregrin Took.",The Return of the King
2014,Gandalf,"Hail Denethor son of Ecthelion, Lord and Steward of Gondor.",The Return of the King
2018,Bilbo,"The 22nd day of September in the year 1400 ,by Shire reckoning. Bag End, Bagshot Row, Hobbiton, West Farthing, The Shire, Middle Earth. The Third Age of this world.",The Fellowship of the Ring
2019,Bilbo,"There and back again, A Hobbit's tale, by Bilbo Baggins.Now, where to begin? Ah, yes.Concerning Hobbits.",The Fellowship of the Ring
2020,Bilbo Voiceover,"Hobbits have been living and farming in the four Farthings of the Shire for many hundreds of years. quite content to ignore and be ignored by the world of the Big Folk. Middle Earth being, after all, full of strange creatures beyond count. Hobbits must seem of little importance, being neither renowned as great warriors, nor counted amongst the very wise.",The Fellowship of the Ring
2021,Bilbo,"Frodo, someone at the door.In fact, it has been remarked by some that Hobbits' only real passion is for food. A rather unfair observation, As we have also developed a keen interest in the brewing of ales ,and the smoking of pipeweed. But where our hearts truly lie, is in peace and quiet ,and good tilled earth.For all Hobbits share a love of all things that grow.And yes, no doubt to others, our ways seem quaint, But today of all days, it is brought home to me it is no bad thing to celebrate a simple life.",The Fellowship of the Ring
2022,Bilbo,"Frodo, the door! sticklebacks, where is that boy! FRODO!",The Fellowship of the Ring
2023,Gandalf,"Hmm hmm hmm hmm, Down from the door where it began, hmm hmm hmm hmm",The Fellowship of the Ring
2024,Gandalf,"And I must follow if I can. The road goes ever on and on, down from the door where it began, now far ahead the road has gone, and I must follow if I can.",The Fellowship of the Ring
2035,Gollum,"Too risky. Too risky.Thieves. They stole it from us. Kill them, kill them, kill them both!",The Return of the King
2037,Gollum,"Sshh, quiet, mustn't wake them. Mustn't ruin it now.",The Return of the King
2038,Smeagol,"But they knows, they knows, they suspects us!",The Return of the King
2039,Gollum,"What's it saying my precious, my love? Is Smeagol losing his nerve?",The Return of the King
2040,Gimli,"Soon Mr Elf, you will enjoy the fabelled hospitality of the dwarves. Roaring fires! Malt Beer! Red Meat off the bone!",The Fellowship of the Ring
2043,Boromir,"This isn't a mine, it's a tomb",The Fellowship of the Ring
2049,Merry,"Hello, Pip.",The Two Towers
2053,Merry,"See? I fooled you too.Don't worry about me, Pippin.",The Two Towers
2064,Merry,"Frodo, this way. Follow me",The Fellowship of the Ring
2077,Gimli,"Strong? ! Oh, that's good.",The Two Towers
2078,Gandalf,"So stop your fretting, Master Dwarf.Merry and Pippin are quite safe.In fact, they are far saferthan you are about to be.",The Two Towers
2084,Treebeard,"Bru-ra-hroom. Don't be hasty.You might call it far, perhaps.My home lies deep in the forest......near the roots of the mountain.I told Gandalf I would keep you safe.And safe is where I'll keep you.I believe you will enjoy this next one too.It's one of my own compositions.Right.",The Two Towers
2085,Treebeard,"Sleep, little Shirelings.Heed no nightly noise.Sleep till morning light.I have business in the forest.There are many to call.Many that must come.The Shadow lies on Fangorn.The withering of all woodsis drawing near.",The Two Towers
2094,Bilbo,"Dragon! Nonsense, there hasn't been a dragon in these parts for a thousand years.",The Fellowship of the Ring
2100,Bilbo,"My dear Bagginses and Boffins, Tooks and Brandybucks ,, Grubbs ,, Chubbs ,, Hornblowers ,, Bulgers ,, Bracegirdles ,, and Proudfoots",The Fellowship of the Ring
2107,Pippin,"I offer you my service, such as it is in payment of this debt.",The Return of the King
2111,Gandalf,"My lord, there will be a time to grieve for Boromir but it is not now. War is coming. The enemy is on your doorstep. As steward, you are charged with the defence of this city. Where are Gondor's armies? You still have friends. You are not alone in this fight. Send word to Theoden of Rohan. Light the beacons.",The Return of the King
2112,Denethor,"You think you are wise Mithrandir. Yet for all your subtleties you have not wisdom. Do you think the eyes of the White Tower are blind? I have seen more than you know. With your left hand you would use me as a shield against Mordor and with your right you would seek to supplant me. I know who rides with Theoden of Rohan. Oh yes, word has reached my ears of this Aragorn, son of Arathorn. And I tell you now. I will not bow to this Ranger from the North. Last of a ragged house long bereft of Lordship.",The Return of the King
2113,Gandalf,"Authority is not given to you to deny the return of the King, steward.",The Return of the King
2116,Gandalf,"All had turned to vain ambition. He would use even his grief as a cloak! A thousand years this city has stood and now at the whim of a madman it will fall! And the white tree, the tree of the King will never bloom again.",The Return of the King
2117,Gandalf,"A wizard is never late! Frodo Baggins. Nor is he early, he arrives precisely when he means to.",The Fellowship of the Ring
2124,Bilbo Voiceover,"And so life in the Shire goes on, very much as it has this past age. Full of its own comings and goings with change coming slowly, if it comes at all.For things are made to endure in the Shire, passing from one generation to the next. There's always been a Baggins living here under the Hill, in Bag End",The Fellowship of the Ring
2126,Frodo,"To tell you the truth, Bilbo has been acting a bit odd lately.I mean, more than usual. He's taken to locking himself in his study. He spends hours and hours poring over old maps when he thinks I'm not looking.",The Fellowship of the Ring
2129,Frodo,"He's up to something. All right then, keep your secrets!",The Fellowship of the Ring
2132,Gollum,"And we will! Smeagol did it once, he can do it again! Its ours! Ours!",The Return of the King
2136,Gollum,"Yes, the stairs and then?",The Return of the King
2137,Smeagol,"Up, up, up the stairs we go until we come to the tunnel.",The Return of the King
2138,Gollum,"And when they go in, there's no coming out. She's always hungry. She always needs to' feed. She must eat. All she gets is filthy Orcses.",The Return of the King
2139,Smeagol,"And they doesn't taste very nice, does they Precious?",The Return of the King
2140,Gollum,"No, not very nice at all, my love. She hungers for sweeter meats. Hobbit meat. And when she throws away the bones and the empty clothes, then we will find it.",The Return of the King
2143,Smeagol,"Yes, we meant for us! Gollum, gollum. The precious will be ours once the Hobbitses are dead!",The Return of the King
2151,Gandalf,"We now have but one choice, we must face the long dark of Moria. Be on your guard, there are older and fouler things than orcs in the deep places of the world",The Fellowship of the Ring
2152,Gandalf,"The wealth of Moria is not in gold, or jewels, but Mithril",The Fellowship of the Ring
2155,Gandalf,"Yes. I never told him, but its worth was greater than the value of The Shire!",The Fellowship of the Ring
2163,Merry,"The Brandywine Bridge, twenty miles.",The Fellowship of the Ring
2169,Gatekeeper,"alright young sir, I meant no offence.My job to ask questions after nightfall. There's talk of strange folk abroad. Can't be too careful",The Fellowship of the Ring
2174,Bilbo,"Alas, elevnty-one years is far too short a time to live among such excellent and admirable hobbits., I don't know half of you half as well as I should like and I like less than half of you, half as well as you deserve.",The Fellowship of the Ring
2176,Gandalf,"They guard it because they have hope. A faint and fading hope that one day it will flower. That a king will come and this city will be as it once was before it fell into decay. The old wisdom born out of the west was forsaken. Kings made tombs more splendid than the houses of the living and counted the old names of their descent, dearer than the names of their sons. Childless lords sat in aged halls musing on heraldry or in high, cold towers asking questions of the stars. And so the people of Gondor fell into ruin. The line of Kings failed. The white tree withered. The rule of Gondor was given over to lesser men.",The Return of the King
2178,Gandalf,"Yes, there it lies. This city has dwelt ever in the sight of its shadow.",The Return of the King
2180,Gandalf,"This is not the weather of the world. This is a device of Sauron's making. A broil of fume he sends ahead of his host. The Orcs of Mordor have no love of daylight, so he covers the face of the sun to ease their passage along the road to war. When the shadow of Mordor reaches this city it will begin.",The Return of the King
2182,Gandalf,"Oh, it's too late for that Peregrin. There's no leaving this city. Help must come to us.",The Return of the King
2187,Frodo,"We never had any adventures, or did anything unexpected.",The Fellowship of the Ring
2188,Gandalf,"If you're referring to the incident with the dragon, I was barely involved. All I did was give your uncle a little nudge out of the door.",The Fellowship of the Ring
