Column,char,dialog,movie
2189,Frodo,"Whatever you did, you've been officially labelled as a 'disturber of the peace.'",The Fellowship of the Ring
2194,Frodo,"Gandalf, I'm glad you're back.",The Fellowship of the Ring
2196,Gollum,"No, no! Master!",The Return of the King
2199,Gollum,"Never! Smeagol wouldn't hurt a fly! Aaaagh he is a horrid, fat Hobbit who hates Smeagol and who makes up nasty lies!",The Return of the King
2220,Gandalf,"Escaped, or was set loose and now the Ring has drawn him here, He won't ever be rid of his need for it. He hates and loves the Ring, as he hates and loves himself. Smeagol's life is a sad story, Yes, he was once called, before the Ring found him. Before it drove him mad",The Fellowship of the Ring
2222,Gandalf,"Pity? It was pity that stayed Bilbo's hand. Many that live deserve death and many that die, deserve life. Can you give it to them Frodo? Do not be too eager to deal out death and judgement Even the very wise cannot see all ends. My heart tells me that Gollum has some part to play, yet for good or ill.... before this is over. The pity of Bilbo, may rule the fate of many",The Fellowship of the Ring
2224,Gandalf,"So do all who live to see such times, but that is not for them to decide. All we have to decide is what to do with the time that is given to us. There are other forces at work in this world, Frodo, besides the will of evil. Bilbo was meant to find the Ring, in which case you also were meant to have it and that is an encouraging thought. Oh! Its that way",The Fellowship of the Ring
2225,Barliman,"Good Evening little masters. What can I do for you? If you're looking for accomodation, we've got some nice, cosy hobbit sized rooms available. Always proud to cater to the little folk, Mr err...?",The Fellowship of the Ring
2226,Frodo,"Underhill, my name's Underhill",The Fellowship of the Ring
2227,Barliman,"Underhill, yes..",The Fellowship of the Ring
2229,Barliman,"Gandalf? Gandalf? Oh yes! I remember! Elderly chap! Big grey beard, pointy hat. Not seen him for six months.",The Fellowship of the Ring
2233,Merry,"This my friend, is a pint!",The Fellowship of the Ring
2240,Bilbo,"No thank you! We don't want any more visitors, well wishers or distant relations!",The Fellowship of the Ring
2246,Bilbo,"Come on, come in! Welcome, welcome. Oh, here we are.",The Fellowship of the Ring
2247,Bilbo,"Tea or maybe something a little stronger? I've got a few bottles of the Old Winyard left, 1296, a very good year, almost as old as I am.",The Fellowship of the Ring
2248,Bilbo,"It was laid down by my father, what say we open one eh?",The Fellowship of the Ring
2249,Gandalf,"Just tea, thank you.",The Fellowship of the Ring
2253,Frodo,"I know Sam, I know. Trust me. Come Smeagol.",The Return of the King
2255,Eowyn,"I dreamed I saw a great wave climbing over green lands and above the hills. I stood upon the brink. It was utterly dark in the abyss before my feet. A light shone behind me but I could not turn, I could only stand there, waiting.",The Return of the King
2257,Legolas,"The stars are veiled. Something stirs in the East, a sleepless malice, The eye of the enemy is moving.",The Return of the King
2262,Pippin,"I just want to look at it, just one more time.",The Return of the King
2267,Gandalf,"No, but the air doesnt smell so foul down here. If in doubt, Meriadoc, always follow your nose.",The Fellowship of the Ring
2268,Gandalf,"Let me risk a little more light, Behold the great realm and dwarf city of Dwarrowdelf.",The Fellowship of the Ring
2272,Gimli,"No, no, no",The Fellowship of the Ring
2273,Gandalf,"Here lies Balin, son of Fundin, Lord of Moria. He is dead then. Its as I feared.",The Fellowship of the Ring
2274,Legolas,"We must move on, we cannot linger.",The Fellowship of the Ring
2275,Gandalf,"They have taken the Bridge and the second hall. We have barred the gates, but cannot hold them for long. The ground shakes. Drums, Drums in the deep. We cannot get out. A shadow moves in the dark. We cannot get out. They are coming.",The Fellowship of the Ring
2276,Gandalf,"Fool of a Took! Throw yourself in next time, and rid us of your stupidity!",The Fellowship of the Ring
2281,Barliman,"He's one of them rangers. They're dangerous folk they are. Wandering the wilds. What his right name is, I've never heard, but round here, he's known as Strider.",The Fellowship of the Ring
2284,Pippin,"Baggins? Sure I know a Baggins! He's over there. Frodo Baggins! He's my second cousin once removed on his mother's side, and my third cousin twice removed on his father's side, if you follow me.",The Fellowship of the Ring
2288,Sauron Voice,"You cannot hide! I see you! There is no life in the void, Only death!",The Fellowship of the Ring
2293,Strider,"Indeed, I can avoid being seen if I wish. But to disappear entirely That is a rare gift!",The Fellowship of the Ring
2294,Bilbo,"You've caught me a bit unprepared I'm afraid urm we've only got cold chicken and a bit of pickle oh and there's some cheese here, oh no that wont do! Urm we've got raspberry jam, an apple tart, but we've not much for afters. Oh no we're all right, I've found some sponge cake! I can make you some eggs if you ' oh'. Gandalf?",The Fellowship of the Ring
2295,Gandalf,"Just tea, thank you.",The Fellowship of the Ring
2296,Bilbo,"Oh right. You don't mind if I do, do you?",The Fellowship of the Ring
2301,Bilbo,"They're after the house! They've never forgiven me for living this long. I've got to get away from these confounded relatives hanging on the bell all day, never giving me a moment's peace. I want to see mountains again, mountains Gandalf. And then find somewhere quiet where I can finish my book. Oh, tea!",The Fellowship of the Ring
2303,Bilbo,"Yes, yes, it's all in hand. All the arrangements are made. Oh, thank you.",The Fellowship of the Ring
2305,Bilbo,"Of course he does, he's a Baggins, not some blockheaded Bracegirdle from Hardbottle.",The Fellowship of the Ring
2317,Pippin,"Gandalf, forgive me!",The Return of the King
2319,Pippin,"A tree, there was a white tree in a courtyard of stone. It was dead.The city was burning.",The Return of the King
2331,Strider,"They were once men. Great Kings of Men. The Sauron the Deciever gave to them nine rings of power. Blinded by their greed they took them without question. One by one falling into darkness ,Now they are slaves to his will. They are the Nazg'l. Ringwraiths. Neither living nor dead. At all times they feel the presence of the Ring, Drawn to the power of the One, They will never stop hunting you.",The Fellowship of the Ring
2335,Frodo,"I think a servant of the enemy would look fairer, but feel fouler.",The Fellowship of the Ring
2338,Bilbo,"Yes, yes.",The Fellowship of the Ring
2340,Bilbo,"I know, he'd probably come with me if I asked him to. I think in his heart Frodo's still in love with the Shire, the woods, the fields and the little rivers. I am old Gandalf. I know I don't look it, but I'm beginning to feel it in my heart. I feel thin, sort of stretched like butter scraped over too much bread. I need a holiday, a very long holiday. And I don't expect that I shall return. In fact, I mean not to.",The Fellowship of the Ring
2341,Bilbo,"Old Toby, the finest weed in the Southfarthing.",The Fellowship of the Ring
2342,Bilbo,"Gandalf my old friend, this will be a night to remember.",The Fellowship of the Ring
2349,Gan Dalf,"His defeat at Helm's Deep showed our enemy one thing. He knows the Heir of Elendil has come forth, Men are not as weak as he supposed. There is courage still. Strength enough, perhaps, to challenge him. Sauron fears this. He will not risk the peoples of Middle Earth uniting under one banner. He will raze Minas Tirith to the ground, before he sees a King return to the throne of men. If the beacons of Gondor are lit Rohan must be ready for war.",The Return of the King
2362,Pippin,"What about elvenses? Luncheon, Afternoon Tea, Dinner? Supper! He knows about them, doesnt he?",The Fellowship of the Ring
2365,Gandalf,"They will be. You must come to Minas Tirith by another road. Follow the river. Look to the black ships. Understand this, things are now in motion that cannot be undone. I ride for Minas Tirith, and I wont be going alone.",The Return of the King
2366,Gandalf,"Of all the Hobbits, Peregrin Took, you are the worst! Hurry! Hurry!",The Return of the King
2369,Pippin,"I don't know, I can't help it.",The Return of the King
2377,Merry,"Here, something for the road.",The Return of the King
2380,Pippin,"But, we'll see each other soon?",The Return of the King
2384,Gandalf,"Run, Shadowfax show us the meaning of haste.",The Return of the King
